{
  "schema_version": "4.4.0",
  "task_id": "TASK-001",
  "stage": "L1-FORMAL-PROJECT",
  "risk": "R2",
  "baseline_digest": "77478e2a918e6dc7984f79534abcd5415cdbb07bb2c7de2346aceb03e5484f4f",
  "requirement_ids": [
    "UI-REQ-005",
    "SEC-REQ-001"
  ],
  "goal": "Implement critical setting cards with save buttons and RBAC.",
  "allowed_paths": [
    "src/**",
    "tests/**",
    "docs/**"
  ],
  "forbidden_paths": [
    "requirements/**",
    ".ai/policies/**"
  ],
  "required_gates": [
    "build",
    "unit",
    "e2e",
    "frontend-review",
    "security-review",
    "requirement-conformance"
  ],
  "human_approvals": []
}
